{
  "version": "0.1.0",
  "schemaVersion": 1,
  "generatedAt": "2026-01-01T00:00:00.000Z",
  "sources": {
    "timetables": [
      {
        "id": "default",
        "path": "presets/schools/_default/timetable.json",
        "sha256": "sha256:1dea538e8d0113060d63dee0c2ebd4068e515b7d77dce6e9446200343f3564b3"
      },
      {
        "id": "usts",
        "path": "presets/schools/usts/timetable.json",
        "sha256": "sha256:7f60536005ef6bce600b4beff8bed52fe32f223f72cb8eb2ba3b1d90a80c58b0"
      }
    ],
    "systems": [
      {
        "id": "jwglxt",
        "path": "presets/systems/jwglxt/system.json",
        "sha256": "sha256:1941bb2ba38310ddd806761b73bb8b6b8dbb88873588fdfa91459214d4b302f6"
      },
      {
        "id": "other",
        "path": "presets/systems/other/system.json",
        "sha256": "sha256:5267d69d0c21271af940fb68d84b011a0808154294fae2b9e92a3efe065e8669"
      },
      {
        "id": "qzdatasource",
        "path": "presets/systems/qzdatasource/system.json",
        "sha256": "sha256:4bcd4571220c4be38f4ae319b4eae3d641d1ea1bf655a82d8d65814d330b23e1"
      },
      {
        "id": "urp",
        "path": "presets/systems/urp/system.json",
        "sha256": "sha256:9e7c5f59be36d1bbf6909e8f27cd881c4beff0662732e2fd6881b8c2190cb961"
      }
    ],
    "adapters": {
      "jwglxt.js": "sha256:070522737bf3d60b4f2fff8dd246c2664acef7ce9189e862a8934c40068fa4b0"
    }
  },
  "index": {
    "_generated": true,
    "version": "0.1.0",
    "schemaVersion": 1,
    "generatedAt": "2026-01-01T00:00:00.000Z",
    "schools": [
      {
        "id": "default",
        "name": "通用作息",
        "type": "generic",
        "system": null,
        "aliases": [
          "默认作息"
        ],
        "generic": true,
        "default": true,
        "configPath": "presets/schools/_default/school.json",
        "timetablePath": "presets/schools/_default/school.json"
      },
      {
        "id": "usts",
        "name": "苏州科技大学",
        "region": "江苏",
        "type": "university",
        "system": "jwglxt",
        "aliases": [
          "苏州科技大学",
          "苏科大",
          "USTS"
        ],
        "generic": false,
        "default": false,
        "configPath": "presets/schools/usts/school.json",
        "timetablePath": "presets/schools/usts/school.json"
      }
    ],
    "systems": [
      {
        "id": "jwglxt",
        "name": "正方教务",
        "version": "1.0.0",
        "aliases": [
          "jwglxt",
          "正方教务"
        ],
        "hasParser": true,
        "parserPath": "presets/systems/jwglxt/parse.js",
        "metaPath": "presets/systems/jwglxt/system.json",
        "loginPath": "presets/systems/jwglxt/system.json",
        "detect": {
          "markers": [
            "jwglxt",
            "xskb_list",
            "timetable_con",
            "kbgrid_table"
          ],
          "timetableTableIds": [
            "kbtable"
          ],
          "timetableTableClasses": [
            "kb",
            "timetable",
            "schedule",
            "skb"
          ],
          "gridCellIdPatterns": [
            "\\d{1,2}[-_]\\d{1,2}"
          ]
        },
        "entryPath": "/jwglxt/xtgl/login_slogin.html",
        "hint": "个人课表查询在「信息查询 → 学生课表查询」"
      },
      {
        "id": "other",
        "name": "其他教务",
        "version": "1.0.0",
        "aliases": [
          "other",
          "其他教务"
        ],
        "hasParser": false,
        "metaPath": "presets/systems/other/system.json",
        "loginPath": "presets/systems/other/system.json",
        "detect": {
          "markers": [],
          "timetableTableIds": [],
          "timetableTableClasses": [],
          "gridCellIdPatterns": []
        },
        "entryPath": "/",
        "hint": "自行登录后打开课表页"
      },
      {
        "id": "qzdatasource",
        "name": "强智教务",
        "version": "1.0.0",
        "aliases": [
          "qzdatasource",
          "强智教务"
        ],
        "hasParser": false,
        "metaPath": "presets/systems/qzdatasource/system.json",
        "loginPath": "presets/systems/qzdatasource/system.json",
        "detect": {
          "markers": [
            "qzdatasource",
            "强智",
            "qzjw"
          ],
          "timetableTableIds": [],
          "timetableTableClasses": [],
          "gridCellIdPatterns": []
        },
        "entryPath": "/jsxsd/",
        "hint": "课表在「培养管理 → 我的课表」"
      },
      {
        "id": "urp",
        "name": "URP 教务",
        "version": "1.0.0",
        "aliases": [
          "urp",
          "URP 教务"
        ],
        "hasParser": false,
        "metaPath": "presets/systems/urp/system.json",
        "loginPath": "presets/systems/urp/system.json",
        "detect": {
          "markers": [
            "urp",
            "教学信息服务平台",
            "jwgl\\.urp"
          ],
          "timetableTableIds": [],
          "timetableTableClasses": [],
          "gridCellIdPatterns": []
        },
        "entryPath": "/",
        "hint": "综合教务系统，课表在「课表查询」"
      }
    ]
  },
  "hash": "sha256:b035466f88fa0b8f3ccbffe3f20cd0bff9fe0977291d3cfb08728db758bc5bbd"
}
